{
  "artifact": "computed_verdict",
  "prereg_id": "opt-round-1",
  "prereg_sha256": "2d7f0cb061831e522342892d9f6dab0c832e411c8264f5697f01c70743d6c758",
  "results_sha256": "06e725814c24cc11aeab825bfb351a7e645045276946b344989ea6b817db8b99",
  "gates": [
    {
      "name": "regression_suite",
      "passed": true,
      "detail": "tests_pass=True"
    },
    {
      "name": "selftest_instrument",
      "passed": true,
      "detail": "selftest_pass=True"
    }
  ],
  "criteria": [
    {
      "id": "C1",
      "kind": "positive",
      "status": "PASS",
      "detail": "persistence_fx1_sha='9339b4562b9006d1fc4095bc4b292384d7296cff5f870a13b6895dfd22071acd' == '9339b4562b9006d1fc4095bc4b292384d7296cff5f870a13b6895dfd22071acd'"
    },
    {
      "id": "C2",
      "kind": "positive",
      "status": "PASS",
      "detail": "persistence_fx2_sha='d93fffd6cfaf760eb874d292153f5da50589f51d8118b288c90233ac74308a0c' == 'd93fffd6cfaf760eb874d292153f5da50589f51d8118b288c90233ac74308a0c'"
    },
    {
      "id": "C3",
      "kind": "positive",
      "status": "PASS",
      "detail": "persistence_seconds_400=0.92 <= 0.96"
    },
    {
      "id": "C4",
      "kind": "positive",
      "status": "PASS",
      "detail": "audit_clean_pass=True"
    },
    {
      "id": "C5",
      "kind": "positive",
      "status": "PASS",
      "detail": "audit_violations_detected=4 >= 4"
    },
    {
      "id": "C6",
      "kind": "positive",
      "status": "PASS",
      "detail": "coherence_equivalent=True"
    },
    {
      "id": "C7",
      "kind": "positive",
      "status": "PASS",
      "detail": "coherence_speedup=9.6 >= 5.0"
    }
  ],
  "verdict": "PASS",
  "verdict_reason": "all 7 computable positive criteria passed",
  "provenance": {
    "producer": "dw_verdict.py",
    "plugin_version": "0.2.0",
    "tier": "real"
  }
}
